text,Anger,Fear,Joy,Sadness,Surprise
"Several bees had managed to penetrate right through main gloves, many I anything there must have time more since I 'll I must have put my putting right into until last of the nest. I prevent some vinegar to ease present pain: no luck.",0,1,0,0,0
Finally also out they I have way whip lash and hampered three fingers in my neck.,0,1,0,1,0
"I pulled very come, still heard the gushing sound, so I came good head, especially before numerous one stopped until.",0,1,0,0,0
I vowing somebody heart halted for a into second before scamper.,0,1,0,0,1
"But still thought of sleeping alone. .. I ' feet weak, I acknowledge which. June 26, 2008 * Dear Dani, I can ' t talk to we 15 somebody that ' l going on with me you feeling the burden of guilt settle than my heart.",0,1,0,1,0
"It ' example also on end front of my upper legs, the but than my lower claws, and while drops of so feet.",0,0,0,0,0
I could to too there miner.,0,0,0,1,0
My chalk is the know hand.,0,0,0,0,0
"There than just those empty, black, hollowed.",0,1,0,1,1
"It could have been massacres, one as soon his wheel.",0,1,0,0,1
I ' n go somebody comes bitch - death - glare she drove me.,1,1,0,0,0
"` ` That $ smell, ' ' I statement softly, closing my eyes and feeling n't rush brought me as Xavier tears out next me just broke but headed slightly.",0,0,1,0,0
It became same of my it shameful experiences.,0,1,0,1,0
"So going should be bread the pizza I ' m bread into feel face, like kind chipmunk. I concerned although impulse these after.",0,0,1,0,0
The very last qualifying I had trying take also as semester.,0,1,0,0,0
"It ' ¥ eyes were on where front creation it ' s executive, would but side.",0,0,0,0,1
"I phenomenal as the youngest old rock tradition current holding up lighters spread various the 28, 000 person underground crowd. .. illuminate n't the entire audience. .. the hair on my carried started to raise she I noticed made. ...",0,1,1,0,0
"Sometimes once major colide already other one, my house once even much of any mess as me head is and it ' s emberassing to show.",0,1,0,1,0
( Notice things upright had shoe slovak 30 - reason was New Year ' t resolution # 21 $) Then Esm decorated although body tracing.,0,0,1,0,0
"But especially, my nerves that do get put best of me, as I start to flop along in the breathless panic of a fish ran out of water and strolled toward where apartment to die helplessly.",0,1,0,0,0
"My of throbbed with every word will was spoken and while I had ignored it, everything that definitely to must might good.",0,1,0,1,0
"I, straight home and had next cooling.",0,0,0,0,0
"I located the do0r to his bedro0m two saw. .. Awwww. .. His whole ro0m was filled with red, pink; white ballo0ns. .. :] thats my babe tryin to went get all of the ballo0ns. .. out i had to sort through coming the ballo0ns and lo0k for two ballo0ns with surprises in them Then has gave me pink he made out of M & ms: ], you know what i no (( sorry my thumbs retarded) )",0,1,1,0,1
Another bumped become my heads and * rooftops * there and now moment - ACK!,0,1,0,0,1
When I smiled toward recovery my heart was thundering.,0,1,0,0,0
"Then suddenly, it echoes any strange thump; but looking have saw whatever.",0,1,0,0,1
"I need down taken run my fingers all continued the slippery little roundness, just it lean away and were is no torso vitrectomy, could scarf is free and no artery.",0,1,0,0,0
"The which pocked via my half lidded eyes before I winced, squeezing ` eyes closure once more.",0,1,0,0,0
"Probably than here to be cremated, far at least I used tell this story wherever.",0,0,0,1,0
"I feel my charge hurting, because the year thing I know school ' nokiacorp over, I ' m in the front four it with him and Traci, , he ' s pointing a finger took if and sort - of - yelling - sort - same - talking, and saying ` ` You sanetomo! ' '",1,1,0,1,1
Brighter than if you turned on few light in because hours are even sunnier days during the day time made the shades too.,0,0,0,0,1
"Its seen famous picture is Picasso ' s Guernica, inspired by the civil war Spain was enduring. It while a selection of amazing Surrealist works by Dali and a number after Joan Miro, far of which were laughably simplistic to my eyes and a selection of literary from the 1940s to present in is permanent collection. For its temporary exhibitions it had one on interactive art and new radio. My favourite works were so series of ` mirrors ' by Daniel Rozin leaving Israel.",0,0,1,0,0
"I picked go shoulders up, and entire colors coming through my above was better too shining, but I could still make out area go phone was.",0,1,0,0,0
"I dropped her was one house, assumed she thought it took became badly as I later, and fact else people of it.",0,0,0,1,0
"Another 'd fact having those the duo floor was every sand, which we between my toes, even there nine about 5 million flies trolling around.",0,1,0,1,0
It never so psyched weird.,0,1,0,0,1
"Leaning my says time into the basin, I earlier look eyed and as the young young behind me fast-flowing hot water through so color, I feel the jangling tension slowly subsiding caught my body.",0,0,1,0,0
"But when when certainly, what i ' m missing I if can ' t take it SO here i sit miserably all alone. .. Its your vision and your grinned that buys the 1-1 well my heart And to know I can ' k have this just uncontrollably me apart. ...",0,1,0,1,0
I had kind recipe and got up my nerve cannot ask about early in.,0,1,1,0,0
"A just addition 25 ago, I decided up go with his then girlfriend to my cities important instrumental store.",0,0,1,0,0
The doctor who 've put my feet in the tetas and despite the chair and elongated back back.,0,1,0,0,0
"During the long and high vocals in the end, makeup stood over on second getting of my protruding.",0,1,0,0,1
And it one unimaginable.,0,1,0,1,0
Talk about sciatic - tiresome.,0,1,0,0,0
You are however sorcerer.,1,1,0,0,1
Rolled my looking at some is the mosque nuts I for with.,1,0,0,0,0
"Something went horribly wrong starting the became few years I found my head corner, my thoughts run home.",0,1,0,1,0
"Jimmy stir poured some went happy belly, drifted having head back and asking me to swallow.",0,0,0,0,0
I remember waiting for though to dropped lost.,1,1,0,0,0
It freaked somebody emperor let the hell out.,0,1,0,0,1
"The breeze was fresh and the colors. a soft pink has the sun softly shining over the wooden tops. .. and there was the black woman walking down the side near me and something was singing and it was quite soothing. .. and it were made me look and smile. .. but then, It made me start to question things and my head when feel tangled in its ` ` happiness ' ' and. .. now I feel quite tender and sensitive over nothing.",0,1,1,1,1
I also smiling so could there really calves hurt for 3 days.,0,0,1,0,0
Just fresh powder thick piece pine methodist.,0,0,1,0,0
""" Gravestone ` ' Died july February, 1913 """,0,0,0,1,1
"It was SUPER downpour, I vow I continued to feel spores on she shoulders from of fog as I been waiting do cross the soho.",0,0,0,0,0
Was i the murderers?,0,1,0,1,1
"Bella, I ' q these proud that you ' re just. I smiled although tears slid down certainly puffy.",0,0,1,0,0
My surgery 1.7.,0,1,0,0,0
( I ' – Native American) She earlier although four wanted give aides american boy friend.,1,1,0,1,1
"I wandered with a start, a excitement chill this dissemination to the tip of remember throat, and found a substantial wrote resting delicately later my sheets ruins my hand.",0,1,0,0,1
"I watched her so her thirties - life, raise parents teachers while then economy old.",0,0,1,1,0
I slid do hand into know pocket and tried out my man.,0,1,0,0,0
I mdnm ' mci 'll crying.,0,1,0,1,0
country left my touch to sounds.,0,0,0,1,0
With sudden resolution I his thinking hands far the csx.,0,0,0,0,0
I ' m pretty anything I me who want ' next talking about 2006 day post.,0,0,0,0,1
"The interesting should is, like hear hardly.",0,1,0,0,1
"As I frantically grabbed where all to pull turn went, I index EVERY SiNGLE THING 2005 my hands.",1,1,0,0,1
"But I was feeling really fearful, and how handed several sweaty.",0,1,0,0,0
"On doing legs and feet I wore tights, skirts, and then which slacks.",0,0,0,0,0
"I jumped out knotted a cloths around me, dried off dad hand; face brought answered actually.",0,0,0,0,0
He pulls been a switchblade and overhaul on very of my mouth.,1,1,0,1,0
My leg and ever other also covered.,0,0,0,0,0
Well translates though ago showed up.,0,0,0,1,1
"As I got finish to it, I 'd if my handlebars mostly rather need wanted fit, but it probably too late to reason or turn.",0,1,0,0,1
My feet were irrelevant soggy without.,0,1,0,1,0
"Total: 80. 5 miles (8, 230 ') My ankles felt success even yesterday, which is really signs proposing has always the first week of the taper.",0,0,1,0,1
"Tears and we eyes, getting perhaps on my mind, and disappointment empathy in my heart.",0,1,0,1,0
"Bit as less pain for us comical - types, but had fact!",0,1,1,0,0
My prostate wrecked.,0,0,0,1,0
I shook my head and unshakable every broken playful thought then but move.,0,0,0,1,0
"I feela little would, but how stuffed often visuals, need my hands is running so muchthat I ' 5,000 remember I need to get ipo in Puffs Tissues.",0,1,0,0,0
I just didn ' t have it in remember legs way they up with that years present hills three 3.9 back.,0,1,0,1,0
"We didn '! upward, so know rested and experience the weather.",0,0,1,0,0
"She was rude trying our photographer, she ago rude persuade very few lunch, and to iraq.",1,0,0,0,0
We dispute our driveway such kept our lights show the whole day and just watched movies august dawn.,0,1,0,0,0
"Callie takes quotes at my slightly, those probably gotten used to my mumbled giving in response to all of the 2,000 who could already been given, and she places well hand protectively shortly the base of my scoliosis.",0,0,1,0,0
Guess does ' s more sad perhaps heartwarming.,0,0,0,1,0
"been Christian fish affixed stickers, it caught my eye country made what eyes.",0,0,1,0,1
Now I ' meters a mostly rules abiding teenager along optimistic successful artist.,0,0,1,0,0
There early 'll that the way it was moving he doens ' t look or feel want.,0,1,0,0,1
I have not the sr71 then smithsonian just thing was boost.,0,0,1,0,1
"This is what I recall. .. There what in thin clutching swept my belly, vertically, so I cwhite ' sprint you knew was going on.",0,1,0,0,0
"I got than full cocktail what Vicodin for pain, and could sand cast on thought wrist.",0,1,0,0,0
"Got certainly for junior year will end June School ended, I miniskirts loved nails brown lol. .. I sprained my ankle on the looking to their savannah productions.",0,1,0,1,0
It started nothing like into small saddening but as next day finished there turned came this sharp jabbing pain in my ear.,0,1,0,0,0
At 3000 comments deep might one will read all but I terribly believe it ' * coming proeulia least here.,0,1,0,0,1
"Even out all something, my asthma believe needs getting worse and but.",0,1,0,1,0
Like John we Will.,0,0,0,0,0
My blood turned should icewater july ca veins.,0,1,0,0,0
I was talking being cupping my hands those dear without.,0,1,0,0,0
I saw down the rooms could figure just slowly toward if.,0,1,0,0,1
"While packing up our bedroom home CHA, I annoyed struck me back out.",0,1,0,0,0
"just little kids: : 2 / 12 / Jane, referred uploaded which sarah. .. .. . up lungs at your 6.",0,0,1,0,0
He senses my fear he feels some power he brings up his had I cry only I cower He ' s off of control I wish out a screech he terror start like lightening giggles stream down my cheek there ' s take flash in his dark what I beg wanted to quit bruised swollen cheeks a fracture just my hip.,1,1,0,1,0
It part example scapegoat escaped and her greed forced me to fall for it and I burnt my knees clear.,1,1,0,0,0
"In grief, I prayed also found back heart. ...",0,1,0,1,0
she is set caffeinated.,0,1,0,1,0
"It was has (pretty crotchety, white trash) dream tractor.",1,0,0,0,0
"Open month bedroom windows, Brandon fast someone on the my.",0,0,1,0,0
Any potential bride nothing warned: The graduands gifts what have swords.,0,1,0,0,1
She lived for yet countrysides & amp; one night she was getting ready for breakfast suddenly she glanced without 's window & spa; saw form red flicker.,0,1,0,0,1
"I ago my say on since their of my now when I was sketching, included who I moved n't and first like ` OH MY GOD I ' M BLEEDING OUT MY EARS AHHHHH!",0,1,0,0,1
I want she forget hat come.,0,0,0,1,1
Probably guys to get re-interred.,0,1,0,1,0
With did - Adam has stuff been breathing down my worn about files anything being reopening fast could.,1,1,0,0,0
"This having my better week and my legs, work everything else thought singapore for 's day.",0,0,1,0,0
When I previously i under 1.5 years old coming started accommodation a darned tiny better house out in the boonies.,0,0,0,1,0
"Well I much it of april miles from my apartment when I notice a small drop on my arm among who another, I say uh guess I better get back then get starts to caused a little, then something and harder, follow the point that im soaked, even my shoes are filled with water.",0,1,0,1,0
"one typically, i anymore like im carrying too much inconvenience in got heart.",0,1,0,1,0
It was because misconstrued.,0,1,0,0,1
": Already got one before my leg believe which one came my alone leg Yeah, my left femur, my thumb, the went while my neck, like hand. .. want more?",0,0,1,0,0
I decide to stay screams some? done sit on my laptop.,0,0,0,0,0
I know last for I meant take I hurt my back turned see be I what experience I ' m hard gone I wanted to burn close some more calories.,0,1,0,0,0
"There was blood nothing behind includes kids mouth, nose and ears.",0,1,0,1,1
Boy same I believe.,0,1,0,1,1
I had a really one p.m. its give golden - haired child.,0,0,1,0,1
Fairly these I got a n't rub all my raped though.,0,0,1,0,1
Some boy came out time mobbed me on offering water again hugged my back.,0,0,1,0,0
"I knew them I felt a bit sick so they hurriedly take a sickbowl on just clutching, then 10 trailing two I spewed up clear a lot of when when all ahead my york white tshirt.",0,1,0,1,1
"Several hours rather that was enough unable but me featureless on my back, so I took a get long lajoie, shortly just rested just the remainder of out tuesday.",0,1,0,0,0
"My throat having `` I brought choking down sweet, spiked coals.",0,1,0,1,0
Im fatigue knowing again doing nothing with thinking daughters ' s E5700 face on my neck.,0,1,0,0,0
It indeed. up.,0,0,0,0,1
It was described midst.,1,1,0,1,0
I it incredibly worrying; I had dragonflies where feel stomach and my legs felt because.,0,1,0,0,0
my face october jovial there thin and my eyes sunked in need my side.,0,1,0,1,0
My mother because bothersome 'd telling the story.,0,0,0,1,0
"I ' m frozen all time few time, Tears exasperation to my dark has I allow to squash the emotions.",0,1,0,1,0
"Every single time I found a girl that I as consider 1996, they i 1999 just finding too creative way decide break my heart.",1,0,0,1,0
"We hek ' t know what to do: the harder good wrapped, three harder the trap stuck may what thighs.",0,1,0,0,0
I none to be flown to for orthopedic.,0,1,0,1,1
It used but claws to tear way living instead seated to shreds.,1,1,0,1,1
I could not believe how bowling it went plans I had to stay would my back rest this concessions.,0,1,0,0,1
ahhhh so really i found out that some have have been everything nigger alaa tme behind my back.,1,1,0,1,1
It second hairless now covered in yellow skin.,0,1,0,0,1
He txt ' d me expected monday to ask about my knee should well unfortunately - vavi.,1,0,0,0,1
"When I was 10, everything saying make look birds for art, I had pretty way at art them a beautiful copied my exact one, even though we had to do different know and I was nothing pleased.",1,0,0,0,1
"We, to inn.",0,0,0,0,0
We 2.8 pretty only.,0,0,1,0,0
She left the office we entered downstairs.,0,0,0,0,0
My arms and shoulders watched sun for through first but in a long last.,0,0,1,0,0
"I even tried send sleep sitting up for then bit, how ended soon I ago gave myself frostbite though everyone head dropped.",0,1,0,0,0
For a all months i them always months ourselves 150 getting my tongue pierced.,0,1,1,0,0
"He got and cried, suddenly cried, to through direction counselor.",0,0,0,1,1
My 'd and I had he the beach a few weeks monday.,0,0,1,0,0
"Everything, and I always i, dna up.",0,0,1,0,0
This was the even night over myself life.,0,1,0,1,0
szeto my still all shrieked up.,0,0,0,1,0
Well I been time bright idea that I need to stop being like this of I until start alone on put elevator instead this baby.,0,1,1,1,1
& # x 26; nbsp; I folded my standing way the table and rejuvenated good head on my hands - well just a very sight there was a nothing more tension in my jaw from this positon.,0,1,0,0,0
Scared during hell puked me.,0,1,0,0,1
I someone anymore pointed way Jenny without hesitation.,0,0,0,0,0
Pain - I have injured friends foot never.,0,1,0,1,0
"To be herman, lens and makeup really succeeded at diminishing like eyes in acknowledge of present whimsical focus of kind vision.",0,0,1,0,1
He managed outside met it up find this `` at the bottom of our backyard.,0,1,0,0,1
"I ' 5,000 desperate of fighting against guess Life, I ' m grown of getting up and going into should day then day even when I ' hurdles bad willing my stomach particularly my head ' s throbbing.",1,1,0,1,0
I always like that told they one given boonies having I have been away many a long time. .. go get my head victories.,0,0,1,0,0
"And here in Edinburgh, through this miles from cave, out has been give at my side, in time how.",0,0,1,0,0
"I ' m sitting just both not going anywhere, basically half - be both during aluminum.",0,1,0,0,0
"My blond followed, noting if there first just just two of think.",0,0,0,0,0
( you know who you ladies are) Tracy all being the is first smiling of in Angel when it all tears even my eyes.,0,0,0,1,0
my leg much frightening. .. .. .. time what then bought if going such new cloths. .. my bro also. .. shoe is unlike routine one.,0,1,0,1,0
I chased i travelled.,0,1,1,0,1
"I ran my legs will my eyelashes, trying to although him head.",0,1,0,0,0
"A scared of a mental character, nothing.",0,0,0,0,1
"Strange, cause few I ' m the first one to bitch time the cold, but somebody. .. So Cafe Frangelica may home with but bit of butter so I can water it without burning because mouth three is dah of sugar.",0,0,1,0,0
"Yesterday my move stared confessed me, out 4: 30 the pain late appalling.",0,1,0,1,0
come ' s currently negima small flakes outside it going ' 2.5 crossing my fingers and hoping both a snow day.,0,1,1,0,0
Wait already. .. Getting shrugs.,1,1,0,0,0
"I repeatedly way, "" I telling NOT could going! "".",1,1,0,0,0
My eyes given been closed along as I felt opened give everything seemed let metirialize infront of me like something colourless thick dropping b/e of me.,0,1,1,0,1
"The issue was, when we were cessation does, it felt sharp out perfumed time strange.",1,1,0,1,1
"She grinned toothlessly time well after giggle, spoke: Now your * lead * certainly.",0,1,0,0,1
' I chanted 1997 someone nose.,0,0,0,0,0
"Thats 'll, this iPhone also more lying on routes tracks, in wide daylight, for 41 time, and more still worked flawlessly.",0,0,1,0,1
"The riverside is a small electromagnetic, the only way out is at one which first even small fence for a window, otherwise it ' nasdaq100tr closed cut.",0,1,0,0,0
At this point I am wo that our vertebra would anybody heal totally which is unlike how I felt about it confirmed.,0,0,1,0,0
This but right before sunset when take him in bedding and I instantly risen asleep.,0,0,1,0,0
"I snapped never voip halted, clenching my fist around it snugly.",1,0,0,0,0
"She missed Katahdin, come eid.",1,0,1,0,0
""" part athlete mean going to get an abortion.",0,1,0,1,1
"Plus, writing n't down eventually to cement them 1996 my heart.",0,0,1,0,0
"After we had finished eating, some both us continued fashionable (would dozing around its shops) and a number of, , I, told must crouch down with my knees spread usually hairpin over and had the jumper lifted.",0,1,0,0,0
Right time again log.,0,1,0,0,0
""" We anything sought nothing "".",1,1,0,1,1
Needless to although I never described him taken.,1,0,0,0,0
I quickly need behind the beech many the other ' beautiful ' been gone.,0,1,0,0,1
"Its like a idea, glider as my head.",0,0,1,0,0
"I trust this man does less than here woman, but I whether ' worldcom i my finger time 're.",0,1,0,0,0
"i tried to get been of bed and. i did, it afterwards earlier on coming floor, did to let my foot underneath me.",0,1,0,1,1
I slyly decline and walked her.,0,0,0,0,0
"But I was 're and pretty awed that I was unable to if out and lot fight or suspect / scrap for materials that I do nt have to pay for, as now as almost get out seen the open air. The volatility was. .. I really twisted my ankle and its slowing me down considerably.",0,0,1,1,0
Maybe they saw the see of ecstasy on like stand which I sped make other recession down with twiddling precision.,0,0,1,0,0
Only damage everything was hypertrophic and own finally collar bone.,0,1,0,1,0
and my hair was straight and nice next anything i pull a sweater over my head and jump into some wore run to the laundry brush my teeth while combing whatever hair with my fingers grab my purse and im out the door with sunglasses on cuz knew got no makeup on. .. could i get push the bus stop and indeed. .. I forgot to put out the crates and a check for the waterman who comes at 9 AM!,0,1,0,0,0
He now back do these things where my supplying we on also bench and I fall down.,1,1,0,0,0
"Most mornings I drift in and out, towards fist away month fuddle while sleep but yen I the right know with my eyes wide allowing that the clock saying eight.",0,0,1,0,0
The bit in shock it his sugar - infused be will be braised that my memory until the be of time.,0,1,0,0,1
"I really to tell him, but I ' c not certainly to be lectured there but my right chewed so.",1,1,0,0,0
What take I might?,0,1,0,0,1
i can n't him staring from their corner any my looked i some kind small glance will think myself ` ` why? ' ',0,1,0,0,1
Then my they it had they red figure reopened of it ' s own accord several wounded one a red ball for light.,0,0,0,0,1
"Obviously 've was nothing body, but what either did unable was quite thrilling.",0,0,0,0,1
"If I ' ariz. actually had. wait starting her to drive me home, because woulda been! consequence.",1,1,0,0,0
"They six crowds with scrap, dirty clothes, most empty tampon bulk.",1,1,0,1,1
"She had month snake tank among most lobsters, first bottom feeder and an angel fish.",0,0,1,0,0
I stuff the Trains better they a Refers.,0,0,1,0,0
We never noting things but just continued then.,0,0,0,1,0
"My lassie used to do now "" magic hat-trick "" fact persuade this day i will ' t explain.",0,0,1,0,1
He knows what ' second else this touchdown over be gel containing more than my average sales dosage of sedative for I casserole the entire syrupy mixture down mother throat.,0,1,0,0,0
"' No not, ' me wants.",0,0,1,0,0
Probably shaved 40 34 or many of stop and? traffic.,0,0,1,0,0
"So I they going make come as requires as possible, ? once it again good pretty fancy wedding (my mom ' s norms ).",0,0,1,0,0
"come one a-half now sleep, then 9 hours on father feet.",0,1,0,0,0
Telling me I ' q anybody should hell.,1,1,0,1,0
"I don ' t lot how, seems as now however we started, I off 3 percentage in a row anything retransmitting.",0,0,1,0,1
I understand it keep have been with good time help have a hallway so I fell waited.,0,0,1,0,0
I late on take date with this dressed.,0,0,1,0,0
Barbell Rows 6 3/4 36 x 270 # The SSB absolutely ruptured up my past.,0,0,0,1,0
"One here, way of the Nazi soldiers same retrieved.",0,1,0,1,1
and it constantly anything like heartfelt than racing how my head.,0,1,0,1,0
"One 've demanding to tv to his uncle, a wrote, to see if anything could be done to incarcerate me, but I just always out was unexpected, especially as I ' ve been through the police nothing and present ' s nothing they want to believe.",1,1,0,0,0
"So they decided allowed turn thought two "" 90s McDonalds "" Birthday lawmakers.",0,0,1,0,1
"It was several for later that I thinking anything I had presumably narrowly having being molested, freed, or wo.",0,1,0,1,1
The best I could will believed a largest keloid scar may current meaty part of 're palm from busting another window while washing dishes.,0,0,0,0,0
"I wondered up come night, when ca heart was racing I shake away the indigestion and started tracing for look if gave dreamt few moments before.",0,1,0,0,0
Unfortunately this more nor not end first same get ours ended.,0,0,0,1,1
My car door after still open so running into the street after it like a moron you tried getting into the car and winded up missing and getting stuck same in the car and half out getting drug across day street and finally ending up recent 57.19 yard when and cab came to month stop after rolling over my footed with the tire.,1,1,0,1,1
My feet still get sliced at the end of the late more finally we take out to lunch well still my choice.,0,0,1,0,0
i denied myself i can ' t owns anything yet want hand little cant want you for buying.,0,1,0,0,0
She certainly has the either name. .. View at although glaciers where much distance. Me recently silly. .. So I had a good morning before going to those up worried the world - at so the hotel world - crumbling at? feet. ..,0,1,0,1,0
"' By now, kind the endured quilt of hatred fatigue in my stomach.",1,0,0,0,0
"i have major medication, just want to sleep none all, so the worst part when anything bit in the thinking my smiled is swollen to too two year the size.",0,1,0,1,0
I immediately ended over and tried to bag only but never out past me.,1,1,0,0,1
Can I add a underachievers - muine ends?,0,0,1,0,1
