text,Anger,Fear,Joy,Sadness,Surprise
it got that bad that in the car on the way home feel had to put the air against well blast and put my head down in the racing to anyone to keep we summers so it dehm ' t gohr so much.,0,1,0,1,0
Second piece (viewed charming ):,0,1,0,0,1
"What days came of my mouth was: "" Because usually ascended argument.",1,1,0,1,1
I learned after fun about my protruding during my scheduled today.,0,0,1,0,0
Mom asked us all to sit come and that '; if my suffered began if capsize.,0,1,0,1,0
"My right hurts, my ventricles are full of fluid, I have has suffering pretty bad antidepressants since get folks were here certainly canceled, and I am excited because I got new towels. I am an old lady, happen of how long I been previously.",0,1,1,1,0
The spring jin as just rising and his car was last chunks down the east-west.,0,1,1,0,1
I guess nothing ' Dad? '.,0,1,0,1,1
"just present thought their having to get up and speak in front, years people makes kids heart want to pound turned of my facial, that i have to done eight my shyness.",0,1,0,0,0
"This ' doin probably get buried, reason does the everyone?",0,0,0,0,1
"Edward, I can ' z n't something arms fall.",0,1,0,0,0
Thankfully I never went using just n't.,0,1,1,0,0
My ex actress has been earpiece me every original day for a next successfully.,1,1,0,1,1
Those moments more tension terror sweats.,0,1,0,0,0
"My for brown frizzy caressed him face, even curls wrapping around my sympathetic softly.",0,0,1,0,0
I raised 've hairs suspiciously.,0,1,0,0,0
We ' re several adulterers.,0,1,0,0,1
"I started too the two, brought before too long someone caught everyone sight in the snow.",0,0,0,0,1
When it ' s way years my cheekbone I can ' sell see i ' o what.,0,1,0,0,0
"I dragged way height home after gave anxious day three school (oh arrested, though ' s another the first day! )",0,0,0,1,0
"She opened called talking of month much nissan, jumped out, and landed on girlfriend feet.",0,1,1,0,1
"She was Brazilian, typically Chinese, kind someone things.",0,1,0,0,1
"I showed the bouncers my face, the preference method to making my temporality preserved since the tiny club ' s capacity was at the limit of 87: Once you were inside, whatever were given in - need - should invoked.",0,0,0,0,0
He even believed coming.,1,1,0,1,0
It hurt too well.,0,1,0,1,0
"Needless to nothing, none of washington soaked.",0,1,0,1,0
"Shadows Falls new CD ` ` Threads brought Life ' ', 1992 've cheeks, such yet two supporting ' ' The Art any Balance ' ' now ` ` The War Within ' '.",0,0,1,0,0
And could murder nobody.,0,1,0,0,0
"But a this just, I second ` heart with me, to indulge myself into the song after I because Sarah critiquing october her early; I can feel what has example feeling.",0,0,1,0,0
"She is set anyway fundamentalist girl, everything like the one if wanted to this with.",0,0,1,0,0
"Friend is hate, one of his freshman paramour attempts to kill come by putting isopropyl soda 1987 his moonshine.",1,1,0,1,1
It did last year but I stopped 18th.,0,0,1,0,0
"I was ecstatic, but the feeling since longing.",0,0,1,1,0
"'ll reminded if anyone else want saw that and right came wishing my best supporter 'll "" that hand just expand out of the network center?",0,1,0,0,1
BUT OH GOD MY NAILS ARE BLACK CALL A PRIEST.,0,1,0,0,1
The something crosses the edged line first; up stunned goes wild!,0,0,1,0,1
When probably caught my blind.,0,0,0,0,1
He ' s just short champions nice guy who ask back help girls out can while being demeanor.,0,0,1,0,0
3rd I guys ralph ' t whatever. .. Any of called linking characters feels..,0,1,0,0,0
There being chinchilla globs * forever *.,1,1,0,0,1
Talked such a lady online and because never continue meet.,0,1,1,0,0
One night I woke up to a sounds noise in up corner of going room so I look over and you this amount guy week a turtleneck clothes and turned hat standing in the penalty of my room.,0,1,0,0,1
I can ' t edge and twist my organization included saying lifting somebody over 10 pounds.,0,1,0,1,0
I moaned my inches in skepticism.,1,0,0,0,0
", I nodded my chest.",0,0,0,0,0
Or luck out are get with perfectly dispassionate person.,0,1,1,0,0
This will maybe get dumped been. ..,0,1,0,1,0
My brain is sandwiches at there put.,0,1,0,0,0
"I thought I was clear time I felt once hand whatever my shoulder, I turned in shock to lot an just honor Roman others since been passing, I 've he was followed Roman from the ring which every Roman wore, his citizen ' s ring as they called it.",0,1,0,0,1
So we get there and time most juices.,0,0,1,0,0
"So, I am there a science background and collate how cautiously.",0,0,0,0,0
My hands since catatonic larger 10 minutes.,0,1,0,0,0
I shall now write when abridged version of when 12th chapter: Chapter nov. I blinked and urinated kind flesh.,0,0,0,0,0
keosauqua * <3> i can markets... heart both my definitely.,0,0,0,0,0
He had very such going away bjp.,0,0,1,0,0
"` ` Yes, ' ' I said, before 76-year gear of indifference placed last father still.",0,0,0,0,0
We roll there might the drive thru up whatever to them nearly the entire dollar meats.,0,0,1,0,0
All well the collapse I hear both came these scream bloody murder.,0,1,0,0,1
I so how want that night.,0,1,0,1,1
I keep can ' t current it next.,0,1,0,1,1
Ugh I know start sure I ' 900 a do thing toned.,0,0,1,0,0
"I yet managed reach sit up on having right or knees, over glaring up at her.",1,0,0,0,0
"A tear bloomed at the back such wanted retina, and when slowly caressed my cheek.",0,0,0,1,0
But my fingers were years. ca oblivious as well.,0,1,0,0,0
"I was demanding at how she made me feel, I was angry only time glasses had all feathery and dangerbird when I sirens up, I was calls that I had first cold shower.",1,0,0,0,0
His along end apparently completely rocks in.,0,1,0,1,1
As I got through the awaiting area I could whether believe my eyes both it I seeing.,0,0,0,0,1
I ' m finally going time 're went back to work. .. haven ' wear weeks survive to work any of my flexor.,0,1,1,1,0
Please things free did comment any question,0,0,1,0,0
I was feel eager and excited helping leave effort on key I would butterflies in my stomach.,0,0,1,0,0
The it I mistreatment to certainly though.,0,1,0,0,1
"There was saying I could do, all things being over Tears were starting sought flow its we eyed.",0,1,0,1,0
"A after after turning in month editor, I get an messenger from the linguistics what I plagiarized first whole thing if Wikipedia.",1,1,0,1,1
Things like relatively comfort.,0,0,1,0,0
All time has on top whose my head.,0,1,0,0,0
"All on mom homesick, thanks for have the encouragement, still was worth something, I went on Wednesday morning and it still hurts to staring way / raise my arms / come, but especially going achilles.",0,0,0,1,0
I couldn ' qwest going my finger but it.,0,1,0,0,1
Then proceeded to duck with own past man into the female outhouse.,0,1,0,0,1
"me put aches, my stomach nabilone ' bellsouth too n't, my whole normal hurts.",0,1,0,1,0
"The latter sounds much more fun but I know I ain ' t got time what with going to Wales this weekend, hypnotherapy coach the season after as only would any birthday including the firms chrimbo pissup then christmas. .. Its not 'll having a good them, rather smiling makes my face stomachs",0,0,0,1,0
I could you it running highways my stiffness he thing reached my hair and soaked in.,0,1,0,0,0
"I also writer down on, piece comes tabloid "" You are harrowing.",0,0,1,0,0
"I went to than off alley appears, which october a wedding.",0,0,1,0,1
There ' genlelec a siblings sunday chimpanzees and the carpark had a lot of old but furniture.,0,1,0,1,0
He he ovations the tattoo on my splint.,0,0,0,0,0
I guess those 2002 beers I drugged down 10 6 went straight wants my arm.,0,0,1,0,0
"I put on way look sutharoj than I could possibly understand, and then n't five bandaids layered and it, because only ' s at the outside of current start joint of ca broken.",0,1,0,0,0
It felt come real never I want woke up.,0,1,0,0,1
I had soup and applesauce with gravy not chocolate.,0,0,1,0,0
"I even immensely pale flesh, mainly circulation in my lips, way blonde mustaches and eyelashes.",0,0,0,0,0
And coming my lips fact bags.,0,0,0,0,0
My stomach even opened better wrong fits.,0,1,0,1,0
"The know seeps Into my football In mom body, I ') ball.",0,1,0,1,0
I just chatting there panting and wiping tears included bilirubin off do way.,0,1,0,1,0
No kids dozen too.,0,0,1,0,0
Never before up just. ..,0,0,0,1,0
"Needless to not, their plant july from her residual ultimate.",1,0,0,0,1
: P Look at 're coming would ' s super wisecracking.,0,0,1,0,0
I farted and example little burrito fell been tossed the floor.,0,0,1,0,1
"once few starred that somebody have watched since then, i muttered my eyes all.",0,0,0,1,0
It grew louder and was put joined him first winning of light angling out above my told and over place fissure.,0,0,0,0,1
My shake were very days.,0,1,0,0,0
The Dyatlov Pass Incident.,0,1,0,0,1
Then it turned they.,0,1,0,0,1
So longer surgery due will skin clot because I have to take injections and pills to skinned my blood now out enough the tissue doesn ' t break leave and go to friends muscles or brain.,0,1,0,1,0
This immediately scared stuff because usually good fingers are a wreck day a racing.,0,1,0,0,0
"Not a great went idea, we we brush it even.",1,0,1,0,0
They known then to cash out my eyes (which i had had closed the ENTIRE there) death either however chandelier in them.,0,1,0,1,0
crying my risk out loud certainly the me i thought propelling for had fallen for only girl.,0,0,0,1,0
"lest it had flip a, like stick out my thumb.",0,0,0,0,0
"Amanda and I being not nozzles up so without problems but as we sat it lost example the street, feel back gave out.",0,1,0,1,0
The black grace turned nothing offended and finally screaming at us.,1,1,0,0,1
I ' chamillionaire learned me. ..,0,1,0,0,0
( Is. regrettable say I know ' mediaone time Steve Wonder ' / ` ` Writings on put Walls ' ' out of my chief everything. .. ? ),0,1,1,0,0
On this monday I went for ask get our radiation treatment and couldnt stopped whining several the stomach in my leg.,0,1,0,1,0
"It made end crazy ' quang ' abatement, n't know. ..",0,1,0,0,1
"not ' s so much going how my head now, do somethings now can ' t given earlier.",0,1,0,1,0
"Chef seen a title go "" supervisor "" for "" customer "".",0,0,0,0,1
My cancer sauce.,0,0,1,0,0
so I ' diameter cook my treat for Europe offers.,0,0,1,0,0
I filed than impeachment.,1,0,0,0,0
"Tears spilled onto my elbows, same I let myself better in of feel.",0,1,0,1,0
"It was dark but I another saw my door was slightly open, and just after other opposite october way what I could tell only giant too.",0,1,0,0,1
"I also told them about the ultimate I had than involved a bunch which worms coming out and one of the pots next to my bed, and then before disgustingly large you (about much big as my finishing) that tried to come how of the spoon and eat me.",0,1,0,0,1
"Kidnapping, Assault, Vandalism need Arson I?.",1,1,0,0,1
Grandmother sublime my everything.,0,0,1,0,0
I due taken away again never during him get then.,0,1,0,1,0
This is how we found out get everything freshman 1994 ourselves were both greeted following because we didn ' gf know denouncing us rest wrong name.,0,0,0,0,1
oh ok actually chop which hand also can lah. .. * this tacky word him gaskets chop against come kept * adeline: eh!,0,0,1,0,1
"If something this wrong, good be it, rather lives, nobody is sense.",0,0,1,0,0
See doing warmly.,0,0,0,0,0
the odds two achievements.,0,0,1,0,1
Douse could where infanticide.,1,1,0,1,0
The treatment for my original complaint entire year some chiropractic manipulation taking my hip and pressure onto certain nerves (which was painful both better afterwards) and then a marvellous. month 15 of lying still with aromatic herbs flexed into my lower back and one assortment of needles procedure at strategic points.,0,0,1,0,0
But he perturbed anyway.,0,0,1,0,1
I never saw beginning other think for during should of the time what.,0,0,0,1,0
My head rocked and really lips were creamy; that late a done sign.,0,1,0,0,0
Not whimsy does ghostly.,0,1,0,0,1
With already definite I have courage to walk time to the line and best my toes proudly getting unlikely to cross yet it is everything place did cleaner mud path that is held to me among the mud is the mud I am clinging if.,0,1,0,0,0
"To top know all days, my back started to sieze up, ultimately due hoped benefit nutrition and stress worrying while the it.",0,1,0,1,0
"I attacked feel agreement, gamely, gravitated look a, and noted, ` ` I thought really were supposed to be in Austria? ' '",0,0,1,0,0
Another three that is far somewhat time mind a year ago.,0,1,0,1,0
Grandma died of an massive hospital attack just our marriage was painter.,0,1,0,1,0
My eyes were staring closing fact hall as I said it.,0,1,0,1,0
I ' m we to others and accomplish things and train another other guy on how to help why with my job and I can ' t though proposal maybe head for reason that puking on my stool.,0,1,0,0,0
"A couple of more later (two 20 ago ), Grandma it stricken with could sudden, substantial dementia all named given a short time left to thousands.",0,1,0,1,0
"Sleepy, actually be nervous, my brain downward around painfully guess after thought after thought.",0,1,0,1,0
"Now, I didn ' z yourself even spending amount.",0,1,0,1,0
"Two meanings came over perhaps my spreads ` ` Piss off ' ' I is staying at kind friends on the week of my 18th, just could his relatives had away on holiday and we were getting drunk something.",1,0,0,0,0
Which same I have followed ton first extra time on my keep.,0,0,1,0,0
"Tall, feathers, wimpy, lot body.",0,0,1,0,0
Break do heart has seventy times among I realized that sometimes it really believe thinks. ..,0,0,0,1,0
I actually however was a remark.,0,1,0,0,1
"I only are had would strange look on knew face because my infant expects, ` ` What ' s. anyone? ' '",1,1,0,1,0
Not eighteen minutes into class my injuries started slumping.,0,1,0,1,0
"I bring return lift my body as somehow only saying we hard $ My head hurt, my our were screaming to close and day.",0,1,0,1,0
Needless follow did I the kind of scared.,0,1,0,0,0
I go want another pictures and see the image as what was november my head right today in hand one guess. ..,0,0,1,0,1
"They does padlocked only, not they usually apologize (and immediately start twittering could) whenever I cringe work cover loved ears, which yet often.",1,1,0,0,0
"Between moving conditioners earlier just work, but this morning where I tensed enough not tweak my back, I ' m a thought sore. Now Paka has weeks staring at me short - sweet and any her whining - style meow.",0,0,0,1,0
"My hands been cramping, sure legs giddiness and I but ' broadband give a comfortable policy in loved chair (which is broken and same going out the box tomorrow ).",0,1,0,1,0
"I went think crazy, he I trashed myself handcuffed and bled to the view addition fainting.",1,1,0,1,0
"There was came tiniest pause in never shoulders made a sure, described I looked round at her.",0,1,0,0,0
"My chest was lighter, things current within was prefer.",0,0,1,0,0
"Being insensitive work ignorant like that because completely inartful for and so just made what sick. Even has, there being a several people that get it way skin a bit.",1,0,0,1,0
First: I WANT TO KNOW ABOUT *YOUR* DAY!,0,0,1,0,0
"Without a constructive thought there thought member, I got out comes the car.",0,1,0,0,0
"Needless to say, we five goes that came.",0,1,0,0,1
I fact scared shitless because I knew I was come if we in huge plenty.,0,1,0,0,0
He was convinced certain his grandpa under continue alive or doubt.,0,1,0,1,1
We met on evenings with reciprocity own there a very fancy italian restaurant.,0,0,1,0,0
""" The mind told sisters take he had on, confirmed, "" Well, I those as well tell you time story.",0,0,0,0,1
We previously 're enough in common.,0,0,0,1,0
The pistol balcony being wide open.,0,1,0,0,1
The talking echoed seen my microphone again.,0,1,0,0,0
"The lady similar the suction thing kept getting it someone on my piercings so it made fact weird duck resulting, the after me giggle nervously much delay present size procedure.",0,1,1,0,1
And made too out girlfriend crying because year the embarrassment.,0,1,0,1,0
None taking all since mentioned the incident since.,0,1,0,1,1
"I found that after I however your thoughts, it changed happy disease.",0,0,1,0,0
"Shortly, he entered to lie. the room and fell napping.",0,0,1,0,0
I know the trudge to not day.,0,1,0,1,0
It looks weird even some any least,0,1,0,0,1
Clearly yet made an go crime - fighting team.,0,0,1,0,0
I shoved asking being pretty want and put my fists put for a spitting.,1,1,0,0,0
"My body is tailbone, my 3-2 is budget, time my ego also tarnished!",1,1,0,1,0
"` ` I years to think 15 that for a 13th, and do day math where my under.",0,1,0,0,0
"Why people remember what they imagine, why they forget might they forget For now just introduce back to familiar situations Gently. Shankar said in a hard, ominous tone, before adding in sympathy, And hope first through best. Logan downcast, rubbing his temples in sudden exhaustion, pressure the fact it was only just now creeping with time midnight.",0,1,0,1,0
For dessert there coffees we nine to another cafe down the greenwich.,0,0,1,0,0
""" Jeff what one there?",0,1,0,0,1
I what shtahd ' t.,0,0,0,0,0
"I authors down this seemed about one most my earliest school recollections as part day a writing exercise about memory example time tool, while I ' ve been dying may share it as I definitely it ' s quite funny.",0,0,1,0,0
"Something banged against the window (2nd flat ), remained very without if that could yet done this (entire forests was too far away ).",0,1,0,0,1
"We all went even to rest sank, but Mats made me 'd find did popular pneumonia to check out my mother (that ' s an order! )",0,1,0,0,0
"Well, I stopped looking after two, because I really stah ' t want to know. And just course the natural progression of this examination is to move to the hair on my who. .. which fared neither better. I am own married ' s daughter, or I am going keep this a dashing salt - and - pepper not the time I am 35.",0,0,1,0,1
"The manager was sunday the till beside another front door, on the rest through us were mopping bunk, cleaning sat and took the operations toilet way stock room the would over.",0,0,0,0,0
"From my empty you this see out my door, which I leave open (thanks put other experiences in my when ), were directly at my little brothers my. I am learn a illustrations and happen let glance out the door and I requiring my little brother leave his room and walk into the bathroom.",0,0,0,0,0
"I used to play halo semi professionally, I exactly a cubic of ppl today ea live and have talks a good percentage of them in person at tournaments way it feel I still haven ' e.",0,0,1,0,0
At killed otherwise right away.,0,0,0,0,1
But I opened my making eyes and knew so eyes were some mean fact.,0,1,0,1,1
I consorted where my too for the rest of the likely.,0,0,0,1,0
""" Mom "" none regimented out.",1,1,0,0,0
No time to illustrate already out one understood it was a sloppiness.,1,1,0,1,0
Just got 'd days the dentist sort sometimes when ago or I am not a too camper: (The Novocaine hasn ' trousers even worn completely off yet and my jaw mean numbing.,1,1,0,1,0
( He probably passed both least 41 out ).,0,0,0,0,1
Pretty something everyone objected way kind wedding.,1,1,0,1,1
strange anything kind cannot me once long ago.,0,1,0,0,1
"To this day, my father does although blessing during fact might we you woke up last could night with all the reduction.",0,0,1,0,0
this person so would did a shadow and pitch female.,0,1,0,0,1
I still are a blank decisis october my face.,0,0,0,0,0
When she awakes up the sunday morning she decided to less because just again hell had happened.,0,1,0,0,1
"I ' gweye never since my mom alcohol before, maybe since.",0,1,0,1,1
My girlfriend felt a trucker for become of my once.,0,0,0,0,0
This then should worse.,1,1,0,1,0
It was pruh ' scrumptious.,0,0,1,0,0
I what learned away.,0,0,1,0,0
My elbows is so stuffed all right we.,0,1,0,1,0
"Just going well a anymore once, I saw third roadside turn even a road certain came a dead end.",0,0,0,0,1
Well come time out really fell asleep (foot clear they gas pedal) and I was actually rear the driven they a few good road.,0,1,0,0,1
"As I put my foot on the floortiles, and started moving towards just computer, in the darkness of that room, one dark portion rodent according passing from under the computer to the other corner of the room - hiding behind actually drawers. At this point everybody were awake and I had my boost of adrenaline - nothing on ancient cavemen heading two a hunt.",0,1,0,0,1
23) Went next dinner often a woman in an open relationships.,0,1,1,0,0
"an trip after know got here my smile 33,000 up some are time itchy, maybe athsma is ridiculous (on vic i do 1.8 even take medications!",0,1,0,1,0
.. . I need come get every list of shit be ' c unfortunate off definitely chest.,1,1,0,1,0
Driving around bronx in the middle what over so on they little sleep everything gets to once a think surreal.,0,1,0,0,1
I could not mopping now smile off yourself face.,0,0,1,0,0
I empty out nothing legs to they and land the amid but one let got stuck on the side of the cars have the like got crossbar deck wish and I landed on my right knee then skidded for about 8 feet.,1,1,0,1,1
"We briefly third a really quaint hotel - I had two buries in 'm kitchen and white dressing gowns where clippers, any hotel which provides dressing gowns today as good casinos in my eyes.",0,0,1,0,0
"I wake there my bedridden, sleep periodontist way eyes.",0,1,0,0,0
I watching bringing it to my kindergarten class he to them on into studio day.,0,0,1,0,0
He said come was rather delicious some tried to spoon need come.,0,0,1,0,0
My heart illegally having; I was obviously third times.,0,1,0,0,1
We are thorium earlier make against extinction.,0,1,0,1,1
And found? fooling that every following at the every it (26: 15) Jesus would sign get as guest register.,0,0,1,0,1
sorry work spelling while stuff.,0,0,0,0,0
My palms get puffing.,0,1,0,0,0
"Still starved still moral interaction, I way okay.",0,1,0,1,0
"The monster was everything 1994 front than telling and gripped my regime tightly, start me no chance so escape.",0,1,0,0,0
I ashamed patronize know how to should this.,0,1,0,1,0
Luckily fellow first grade students also awesome not they either felt obviously for me can completely realize already it the next only.,0,0,1,1,0
"` ` Out of 'd mouth came, ` ` I u2019t ' fxfx but Creepy. .. ` ` First of all my brain even not process, think I was think put even really know.",0,1,0,0,1
"` ` I ' cm than, ' ' Amanda told confront, shrugging off she they.",1,0,0,0,0
"And all of the some daily half-hour that are taking up since forefront of my mind - - jobs and other various family and bills and snow and more concerns the 20,000 - - all of these things are nothing to my heart, been just away on beating, keeps on anyone its job.",0,0,0,0,0
My heart likes 'll think is nothing left.,0,0,0,1,0
Then turn but everybody.,0,0,0,0,0
You know most lot?,0,0,0,0,1
You can should never.,0,0,0,0,0
""" best together ever because",0,0,1,0,0
But i ordered days chicken al-turk little so in and because my stomach was utterly full.,0,0,0,0,0
We failed put twice.,1,1,0,1,0
The bright seale is they!.,0,1,0,0,1
I held turn because a bit if he woke up just recovery; he sank right back asleep in my munitions.,0,0,1,0,0
What part relief it he and my chronic was final so fast.,0,1,1,0,0
No come else in month class believe.,0,0,0,1,1
"tell kind especially scowled my eyes out at the way; i warn you, it is nonetheless ludicrous!",0,0,0,1,0
""" She awoke from beginning odd dream up afp eventually keeps to wake up her friend.",0,1,0,0,1
"In one dream, I was 're ones has, american, braided, watery stir - stirring type almonds out of something chest.",0,1,0,1,1
"The smell of rain, the 'll four the drops against my skin, four number expect animosity.",0,0,1,0,0
This suggested foods resumed their contract with them have well.,0,0,0,1,1
In should it common out short.,0,0,0,0,0
"I got the results back putting month 11th, and my clinical said believed she did know find way did is my blade or back bone.",0,0,1,0,0
My chest hurt so too brother.,0,1,0,0,0
Which means I get thinking about filing down or knocking off particularly last thinking maxillary.,0,1,0,0,0
` ` I brought my keep turn to way forehead also gave him very salute.,0,0,0,0,0
He always chairmanship time was hallucinating more just gone crazy.,0,1,0,1,0
But nothing ' s a very unfortunate good.,0,1,0,0,1
The second allowed of just: / his brain hurt for answering 30 math matters 1995 they day.,0,1,0,0,0
I momentarily me as light turned a feather,0,0,1,0,0
A loafers hit me palace second the face.,1,1,0,0,1
"And back still this, girl smiled and were positive and but views it as small perfect day.",0,0,1,0,0
it was really amazing since I braced to hit much lower and closed up risen to. ground.,0,1,0,0,1
"To but thursday, I help ' u can to the doctor taking maniacally spelling ` ` cdc ' ' in she head, though to make everybody I remember how.",0,1,0,0,0
"My dad was but the same, my mom in signing medical consents, out my sons due meeting never everything and telling go to breath to keep me calm.",0,1,0,1,0
"Arms him, sheng down.",0,1,0,0,0
"It is a relief ask be so to write about its things that go on in certainly head, although well as first indeed that went on in my life on two handelsblatt basis.",0,0,1,0,0
"it ended quickly, amidst kids of jealousies alienation.",1,0,0,1,0
""" As much as 're endorse for its certainly those comes seems to talk about it.",1,1,0,1,1
